{
  "ApplicationInstanceId": "resource-abc123",
  "Arn": "arn:aws:service:us-east-1:123456789012:resource/example",
  "CreatedTime": "example-string",
  "DefaultRuntimeContextDevice": "example-string",
  "DefaultRuntimeContextDeviceName": "my-resource",
  "Description": "example-string",
  "HealthStatus": "active",
  "Name": "my-resource",
  "RuntimeContextStates": "example-string",
  "Status": "active",
  "StatusDescription": "active",
  "Tags": "example-string"
}